{
  "schemaVersion": "0.2",
  "app": {"name": "模块组件与局部响应式状态", "window": {"width": 800, "height": 600}},
  "state": {},
  "actions": {},
  "root": {
    "type": "module", "id": "page", "layout": {"padding": 20, "gap": 16},
    "state": {"pageTitle": "模块 A、B 的状态和动作分别管理"},
    "children": [
      {"type": "text", "id": "heading", "text": {"kind": "state", "key": "pageTitle"}},
      {
        "type": "module", "id": "moduleA", "layout": {"gap": 8},
        "state": {"button": {"text": "下一步", "action": "next", "enabled": true}, "message": "A：尚未更新"},
        "actions": {
          "next": {"steps": [{"type": "set", "target": "button", "value": {"kind": "literal", "value": {"text": "提交", "action": "submit", "enabled": true}}}]},
          "submit": {"steps": [{"type": "set", "target": "button", "value": {"kind": "literal", "value": {"text": "已提交", "action": "submit", "enabled": false}}}, {"type": "set", "target": "message", "value": {"kind": "literal", "value": "A：已提交（本地演示）"}}]}
        },
        "children": [
          {"type": "card", "id": "cardA", "title": {"kind": "literal", "value": "模块 A"}, "layout": {"padding": 16, "gap": 8}, "children": [
            {"type": "text", "id": "messageA", "text": {"kind": "state", "key": "message"}},
            {"type": "button", "id": "buttonA", "text": {"kind": "state", "key": "button", "path": "/text"}, "enabled": {"kind": "state", "key": "button", "path": "/enabled"}, "events": {"click": {"kind": "state", "key": "button", "path": "/action"}}}
          ]}
        ]
      },
      {
        "type": "module", "id": "moduleB", "layout": {"gap": 8},
        "state": {"button": {"text": "下一步", "action": "next", "enabled": true}, "message": "B：尚未更新"},
        "actions": {
          "next": {"steps": [{"type": "set", "target": "button", "value": {"kind": "literal", "value": {"text": "提交", "action": "submit", "enabled": true}}}]},
          "submit": {"steps": [{"type": "set", "target": "button", "value": {"kind": "literal", "value": {"text": "已提交", "action": "submit", "enabled": false}}}, {"type": "set", "target": "message", "value": {"kind": "literal", "value": "B：已提交（本地演示）"}}]}
        },
        "children": [
          {"type": "card", "id": "cardB", "title": {"kind": "literal", "value": "模块 B"}, "layout": {"padding": 16, "gap": 8}, "children": [
            {"type": "text", "id": "messageB", "text": {"kind": "state", "key": "message"}},
            {"type": "button", "id": "buttonB", "text": {"kind": "state", "key": "button", "path": "/text"}, "enabled": {"kind": "state", "key": "button", "path": "/enabled"}, "events": {"click": {"kind": "state", "key": "button", "path": "/action"}}}
          ]}
        ]
      }
    ]
  }
}
